{
  "schema_version": 1,
  "units": "mm",
  "metadata": {
    "source_format": "json",
    "unit_guess": null,
    "determinism_tag": ""
  },
  "entities": [
    {
      "type": "path",
      "id": "p0",
      "stroke": {
        "layer": "CUT",
        "linetype": "solid",
        "weight": 0.2,
        "color_policy": "by_layer"
      },
      "closed": false,
      "segments": [
        { "kind": "line", "a": { "x": 0.0, "y": 0.0 }, "b": { "x": 10.0, "y": 0.0 } },
        { "kind": "line", "a": { "x": 10.0, "y": 0.0 }, "b": { "x": 10.0, "y": 10.0 } },
        { "kind": "cubic_bezier", "a": { "x": 10.0, "y": 10.0 }, "c1": { "x": 12.0, "y": 10.0 }, "c2": { "x": 12.0, "y": 12.0 }, "b": { "x": 10.0, "y": 12.0 } }
      ]
    },
    {
      "type": "text",
      "id": "t0",
      "layer": "GUIDE",
      "pos": { "x": 5.0, "y": 5.0 },
      "text": "hello",
      "size": 12.0,
      "font_hint": null,
      "rotation_rad": 0.0
    }
  ]
}
