{
  "schema_version": 1,
  "units": "mm",
  "entities": [
    {
      "type": "path",
      "id": "P1",
      "closed": true,
      "stroke": {
        "layer": "0",
        "linetype": "CONTINUOUS",
        "weight": 0.25,
        "color_policy": "by_layer"
      },
      "segments": [
        { "kind": "line", "a": { "x": 0.0, "y": 0.0 }, "b": { "x": 100.0, "y": 0.0 } },
        { "kind": "line", "a": { "x": 100.0, "y": 0.0 }, "b": { "x": 100.0, "y": 60.0 } },
        { "kind": "line", "a": { "x": 100.0, "y": 60.0 }, "b": { "x": 0.0, "y": 60.0 } },
        { "kind": "line", "a": { "x": 0.0, "y": 60.0 }, "b": { "x": 0.0, "y": 0.0 } }
      ]
    }
  ],
  "metadata": {
    "source_format": "compat_project_exchange",
    "determinism_tag": "n2_small_v1"
  }
}
