{
  "schema_version": 1,
  "units": "mm",
  "metadata": {
    "source_format": "json",
    "unit_guess": null,
    "determinism_tag": "seed=0;round_step=0.000001000000;close_eps=0.000001000000;approx_eps=0.001000000000"
  },
  "entities": [
    {
      "type": "path",
      "id": "path_0",
      "stroke": {
        "layer": "LAYER_0",
        "linetype": "CONTINUOUS",
        "weight": 0.25,
        "color_policy": "by_layer"
      },
      "closed": false,
      "segments": [
        {
          "kind": "line",
          "a": {
            "x": 0.0,
            "y": 0.0
          },
          "b": {
            "x": 10.0,
            "y": 0.0
          }
        },
        {
          "kind": "line",
          "a": {
            "x": 10.0,
            "y": 0.0
          },
          "b": {
            "x": 10.0,
            "y": 10.0
          }
        },
        {
          "kind": "line",
          "a": {
            "x": 10.0,
            "y": 10.0
          },
          "b": {
            "x": 10.6562,
            "y": 10.0859
          }
        },
        {
          "kind": "line",
          "a": {
            "x": 10.6562,
            "y": 10.0859
          },
          "b": {
            "x": 11.125,
            "y": 10.3125
          }
        },
        {
          "kind": "line",
          "a": {
            "x": 11.125,
            "y": 10.3125
          },
          "b": {
            "x": 11.4062,
            "y": 10.6328
          }
        },
        {
          "kind": "line",
          "a": {
            "x": 11.4062,
            "y": 10.6328
          },
          "b": {
            "x": 11.5,
            "y": 11.0
          }
        },
        {
          "kind": "line",
          "a": {
            "x": 11.5,
            "y": 11.0
          },
          "b": {
            "x": 11.4062,
            "y": 11.3672
          }
        },
        {
          "kind": "line",
          "a": {
            "x": 11.4062,
            "y": 11.3672
          },
          "b": {
            "x": 11.125,
            "y": 11.6875
          }
        },
        {
          "kind": "line",
          "a": {
            "x": 11.125,
            "y": 11.6875
          },
          "b": {
            "x": 10.6562,
            "y": 11.9141
          }
        },
        {
          "kind": "line",
          "a": {
            "x": 10.6562,
            "y": 11.9141
          },
          "b": {
            "x": 10.0,
            "y": 12.0
          }
        }
      ]
    },
    {
      "type": "text",
      "id": "text_1",
      "layer": "GUIDE",
      "pos": {
        "x": 5.0,
        "y": 5.0
      },
      "text": "hello",
      "size": 12.0,
      "font_hint": null,
      "rotation_rad": 0.0
    }
  ]
}